{
  "artifacts": [
    {
      "byte_size": 284,
      "format": "sha256sum",
      "integrity_record_ids": [],
      "package_path": "synthworld/benchmarks/AMBIGUITY_SHA256SUMS",
      "path": "src/synthworld/benchmarks/AMBIGUITY_SHA256SUMS",
      "sha256": "6cfc0483ccd43256010a88ef25df4869a5cfc1cd6e7b0f105b5a4b9cfca26986"
    },
    {
      "byte_size": 99,
      "format": "sha256sum",
      "integrity_record_ids": [],
      "package_path": "synthworld/benchmarks/CONNECTION_PUBLIC_SHA256SUMS",
      "path": "src/synthworld/benchmarks/CONNECTION_PUBLIC_SHA256SUMS",
      "sha256": "bd30a434b0f0cbd912f9e6fcd862c1f7f332deabd9f8bf2a9d83c49bcf39e204"
    },
    {
      "byte_size": 92,
      "format": "sha256sum",
      "integrity_record_ids": [],
      "package_path": "synthworld/benchmarks/CONNECTION_SHA256SUMS",
      "path": "src/synthworld/benchmarks/CONNECTION_SHA256SUMS",
      "sha256": "c2a9612df25d37bea9a2dfeb0e968763f8bb3659b6a4aa8e47d4ea93058b4377"
    },
    {
      "byte_size": 99,
      "format": "sha256sum",
      "integrity_record_ids": [],
      "package_path": "synthworld/benchmarks/EXTRACTION_ANSWER_SHA256SUMS",
      "path": "src/synthworld/benchmarks/EXTRACTION_ANSWER_SHA256SUMS",
      "sha256": "62d59fb12c2b2fe5103bab1f554b4a3db439c5770d958e1d8a846adfd91459bf"
    },
    {
      "byte_size": 99,
      "format": "sha256sum",
      "integrity_record_ids": [],
      "package_path": "synthworld/benchmarks/EXTRACTION_PUBLIC_SHA256SUMS",
      "path": "src/synthworld/benchmarks/EXTRACTION_PUBLIC_SHA256SUMS",
      "sha256": "f520af026f4d886b8903f79e7eae8ab95bd956bd177ac8c526d6e041bc387746"
    },
    {
      "byte_size": 92,
      "format": "sha256sum",
      "integrity_record_ids": [],
      "package_path": "synthworld/benchmarks/EXTRACTION_SHA256SUMS",
      "path": "src/synthworld/benchmarks/EXTRACTION_SHA256SUMS",
      "sha256": "7670a205b7dcc27622ce92648292489bf7517dc6cc359973554aa0d821b4e172"
    },
    {
      "byte_size": 91,
      "format": "sha256sum",
      "integrity_record_ids": [],
      "package_path": "synthworld/benchmarks/HOUSEHOLDS_SMOKE_SHA256SUMS",
      "path": "src/synthworld/benchmarks/HOUSEHOLDS_SMOKE_SHA256SUMS",
      "sha256": "946fb4de22c16d9e47d9a31a5d6e6623d39d1676aacfc30b13529ca81fe17f4d"
    },
    {
      "byte_size": 93,
      "format": "sha256sum",
      "integrity_record_ids": [],
      "package_path": "synthworld/benchmarks/RISK_ANSWER_SHA256SUMS",
      "path": "src/synthworld/benchmarks/RISK_ANSWER_SHA256SUMS",
      "sha256": "07e300c8eee695c0eef60af9a4701cd5df03457215f5c310b1a9d7e05ff087cd"
    },
    {
      "byte_size": 93,
      "format": "sha256sum",
      "integrity_record_ids": [],
      "package_path": "synthworld/benchmarks/RISK_PUBLIC_SHA256SUMS",
      "path": "src/synthworld/benchmarks/RISK_PUBLIC_SHA256SUMS",
      "sha256": "16f95e9d9e9f7539e8f14fab4688cf5c0ed995bb539ad415456ec77c08688a73"
    },
    {
      "byte_size": 81,
      "format": "sha256sum",
      "integrity_record_ids": [],
      "package_path": "synthworld/benchmarks/SHA256SUMS",
      "path": "src/synthworld/benchmarks/SHA256SUMS",
      "sha256": "bebeecf02c0cefdb580194731c5854b5665f11983b0bb8c5ed9cfc7609fbba4f"
    },
    {
      "byte_size": 4117,
      "format": "json",
      "integrity_record_ids": [
        "sha256sum:src/synthworld/benchmarks/AMBIGUITY_SHA256SUMS"
      ],
      "package_path": "synthworld/benchmarks/ambiguity-dispositions-v1.json",
      "path": "src/synthworld/benchmarks/ambiguity-dispositions-v1.json",
      "sha256": "334808680b46f58f78ac820c887548692b057eab97bb6cf41571d1e77dd87e11"
    },
    {
      "byte_size": 3983,
      "format": "json",
      "integrity_record_ids": [
        "sha256sum:src/synthworld/benchmarks/AMBIGUITY_SHA256SUMS"
      ],
      "package_path": "synthworld/benchmarks/ambiguity-memberships-v1.json",
      "path": "src/synthworld/benchmarks/ambiguity-memberships-v1.json",
      "sha256": "42d7f52a4c4a058d2616630dce719fb8c659fd56d4789d91d0cfdee96a264a8e"
    },
    {
      "byte_size": 27251,
      "format": "json",
      "integrity_record_ids": [
        "sha256sum:src/synthworld/benchmarks/AMBIGUITY_SHA256SUMS"
      ],
      "package_path": "synthworld/benchmarks/ambiguity-public-v1.json",
      "path": "src/synthworld/benchmarks/ambiguity-public-v1.json",
      "sha256": "217b0eaeb772c8594ebd89a9b0d8ba205063ed3363d482dab32de15ef82d4b7a"
    },
    {
      "byte_size": 1871,
      "format": "json",
      "integrity_record_ids": [
        "c08-asteria-evaluator:src/synthworld/benchmarks/asteria-agentic-c08-v2/evaluator/manifest.json",
        "c08-asteria-root:src/synthworld/benchmarks/asteria-agentic-c08-v2/manifest.json"
      ],
      "package_path": "synthworld/benchmarks/asteria-agentic-c08-v2/evaluator/c08-asteria-evaluator.json",
      "path": "src/synthworld/benchmarks/asteria-agentic-c08-v2/evaluator/c08-asteria-evaluator.json",
      "sha256": "b94fc5791e36e43e2b2586cdab0c7aaec9c249700e060a784ccc582b13b777f4"
    },
    {
      "byte_size": 465,
      "format": "json",
      "integrity_record_ids": [
        "c08-asteria-root:src/synthworld/benchmarks/asteria-agentic-c08-v2/manifest.json"
      ],
      "package_path": "synthworld/benchmarks/asteria-agentic-c08-v2/evaluator/manifest.json",
      "path": "src/synthworld/benchmarks/asteria-agentic-c08-v2/evaluator/manifest.json",
      "sha256": "bc701080cf88c8a446e31d5d379c360b29939bf51a7e3e017ce41f417bfce45c"
    },
    {
      "byte_size": 1201,
      "format": "json",
      "integrity_record_ids": [],
      "package_path": "synthworld/benchmarks/asteria-agentic-c08-v2/manifest.json",
      "path": "src/synthworld/benchmarks/asteria-agentic-c08-v2/manifest.json",
      "sha256": "cb8deb43ab6216c4d913e294a7a88d882aabb75a6ecbc87f66011eb8099ad50b"
    },
    {
      "byte_size": 8106,
      "format": "json",
      "integrity_record_ids": [
        "c08-asteria-public:src/synthworld/benchmarks/asteria-agentic-c08-v2/public/manifest.json",
        "c08-asteria-root:src/synthworld/benchmarks/asteria-agentic-c08-v2/manifest.json"
      ],
      "package_path": "synthworld/benchmarks/asteria-agentic-c08-v2/public/c08-asteria-public.json",
      "path": "src/synthworld/benchmarks/asteria-agentic-c08-v2/public/c08-asteria-public.json",
      "sha256": "b9ed17cac90721a276b28570bd91b5c6f41b106dad5be15fa1257a7e9a16ade3"
    },
    {
      "byte_size": 370,
      "format": "json",
      "integrity_record_ids": [
        "c08-asteria-root:src/synthworld/benchmarks/asteria-agentic-c08-v2/manifest.json"
      ],
      "package_path": "synthworld/benchmarks/asteria-agentic-c08-v2/public/manifest.json",
      "path": "src/synthworld/benchmarks/asteria-agentic-c08-v2/public/manifest.json",
      "sha256": "5313551de8dbf5f6cdf97447fe9ade9c0fa73500dfd8fd387aa8aa4954de69c3"
    },
    {
      "byte_size": 6406,
      "format": "jsonl",
      "integrity_record_ids": [
        "asteria-evaluator:src/synthworld/benchmarks/asteria-agentic-v1/evaluator/checksums.json"
      ],
      "package_path": "synthworld/benchmarks/asteria-agentic-v1/evaluator/authority_truth.jsonl",
      "path": "src/synthworld/benchmarks/asteria-agentic-v1/evaluator/authority_truth.jsonl",
      "sha256": "093efedf08d1db33e04335bd846a50b58bb8222bb2395dca8358d8e2820536b0"
    },
    {
      "byte_size": 6061,
      "format": "json",
      "integrity_record_ids": [
        "asteria-evaluator:src/synthworld/benchmarks/asteria-agentic-v1/evaluator/checksums.json"
      ],
      "package_path": "synthworld/benchmarks/asteria-agentic-v1/evaluator/canonical_bindings.json",
      "path": "src/synthworld/benchmarks/asteria-agentic-v1/evaluator/canonical_bindings.json",
      "sha256": "9ed29aa54a1c05d9ae2b62797059a85fb96c6710b762568465f98222fc844cdf"
    },
    {
      "byte_size": 1061,
      "format": "jsonl",
      "integrity_record_ids": [
        "asteria-evaluator:src/synthworld/benchmarks/asteria-agentic-v1/evaluator/checksums.json"
      ],
      "package_path": "synthworld/benchmarks/asteria-agentic-v1/evaluator/cases.jsonl",
      "path": "src/synthworld/benchmarks/asteria-agentic-v1/evaluator/cases.jsonl",
      "sha256": "a44d28143128da2051c665e8ae421e1b2d3af0cb2e364d42af099f0ecc8b35a5"
    },
    {
      "byte_size": 997,
      "format": "json",
      "integrity_record_ids": [],
      "package_path": "synthworld/benchmarks/asteria-agentic-v1/evaluator/checksums.json",
      "path": "src/synthworld/benchmarks/asteria-agentic-v1/evaluator/checksums.json",
      "sha256": "0b16503d3d481cad163f5ab70ed3c60d6ed0f028eabf14351734a08beae4d387"
    },
    {
      "byte_size": 3674,
      "format": "jsonl",
      "integrity_record_ids": [
        "asteria-evaluator:src/synthworld/benchmarks/asteria-agentic-v1/evaluator/checksums.json"
      ],
      "package_path": "synthworld/benchmarks/asteria-agentic-v1/evaluator/evidence_epochs.jsonl",
      "path": "src/synthworld/benchmarks/asteria-agentic-v1/evaluator/evidence_epochs.jsonl",
      "sha256": "e685ee9b0334eb5c2ae5905e930d6302160e525634eb92f0c4334a8a5c9d15a8"
    },
    {
      "byte_size": 2275,
      "format": "jsonl",
      "integrity_record_ids": [
        "asteria-evaluator:src/synthworld/benchmarks/asteria-agentic-v1/evaluator/checksums.json"
      ],
      "package_path": "synthworld/benchmarks/asteria-agentic-v1/evaluator/expected_decisions.jsonl",
      "path": "src/synthworld/benchmarks/asteria-agentic-v1/evaluator/expected_decisions.jsonl",
      "sha256": "49e68d770b3a68666d193d1304d0eaebc67eb689c66ff4697ba59db6be41be49"
    },
    {
      "byte_size": 3597,
      "format": "jsonl",
      "integrity_record_ids": [
        "asteria-evaluator:src/synthworld/benchmarks/asteria-agentic-v1/evaluator/checksums.json"
      ],
      "package_path": "synthworld/benchmarks/asteria-agentic-v1/evaluator/expected_provenance.jsonl",
      "path": "src/synthworld/benchmarks/asteria-agentic-v1/evaluator/expected_provenance.jsonl",